{
  "registry_version": "1.0",
  "updated_at": "2026-05-07",
  "source": {
    "generated_by": "docs/harness bootstrap task",
    "inputs": [
      "codebase_mapper report",
      "feature_inventory_agent report",
      "test_inventory_agent report",
      "docs_inventory_agent report",
      "harness_planner report",
      "sequential coordinator inspection of pyproject.toml, README.md, contract2agent/cli.py, docs, tests, examples, scripts, and CI files"
    ],
    "notes": "This registry preserves historical evidence where visible. Tests were not run during the 2026-05-07 docs/harness bootstrap task."
  },
  "status_policy": {
    "default_for_inferred": "needs_verification",
    "verified_pass_requires": "Concrete evaluator, test, command, or artifact evidence tied to the feature. Historical evidence must keep its date and must not be presented as a fresh validation run.",
    "unknown_policy": "Unknown or uninspected features must not be marked failed. Use needs_verification, inferred, implemented_pending_evaluation, or blocked with explicit notes.",
    "failed_policy": "This registry intentionally has no failed default status. A failure claim requires evaluator/test evidence and should be recorded in progress or handoff before changing feature status."
  },
  "features": [
    {
      "id": "cli_c2a_entrypoint",
      "name": "c2a CLI and legacy agentdoctor alias",
      "summary": "The package exposes the primary c2a console script and a legacy agentdoctor alias that dispatch to contract2agent.cli:main.",
      "visibility": "developer_visible",
      "status": "verified_pass",
      "confidence": "high",
      "evidence": [
        {
          "kind": "source",
          "path": "pyproject.toml",
          "detail": "[project.scripts] declares c2a and agentdoctor."
        },
        {
          "kind": "source",
          "path": "contract2agent/cli.py",
          "detail": "CLI main dispatches to Typer or argparse fallback."
        },
        {
          "kind": "historical_record",
          "path": "docs/harness/PROGRESS.md",
          "detail": "Records python -m pytest passing 355 tests on 2026-05-06.",
          "date": "2026-05-06"
        }
      ],
      "tests": [
        "tests/test_docs_site.py",
        "tests/test_contract2agent.py"
      ],
      "docs": [
        "README.md",
        "docs/cli.md",
        "docs/CODEMAP.md"
      ],
      "risks": [
        "The legacy alias is compatibility surface; do not rename casually."
      ],
      "notes": "Verified status rests on dated repository evidence, not a test run from the 2026-05-07 bootstrap task.",
      "last_updated": "2026-05-07",
      "last_verified": "2026-05-06"
    },
    {
      "id": "contract_scaffold_generation",
      "name": "Requirement parsing and demo/scaffold generation",
      "summary": "Requirement text and contract files can be turned into generated demo or scaffold projects.",
      "visibility": "user_visible",
      "status": "verified_pass",
      "confidence": "high",
      "evidence": [
        {
          "kind": "source",
          "path": "contract2agent/parser.py, contract2agent/compiler.py, contract2agent/generator.py",
          "detail": "Modules implement parsing, compilation, and template rendering."
        },
        {
          "kind": "test",
          "path": "tests/test_contract2agent.py",
          "detail": "Covers parser, demo generation, counterexamples, and CLI flows."
        },
        {
          "kind": "historical_record",
          "path": "docs/harness/PROGRESS.md",
          "detail": "Records full pytest pass on 2026-05-06.",
          "date": "2026-05-06"
        }
      ],
      "tests": [
        "tests/test_contract2agent.py"
      ],
      "docs": [
        "README.md",
        "docs/cli.md",
        "contract2agent/README.md"
      ],
      "risks": [
        "Template changes affect generated project behavior and should use focused tests."
      ],
      "notes": "Preserve legacy scaffold behavior unless a sprint contract explicitly changes it.",
      "last_updated": "2026-05-07",
      "last_verified": "2026-05-06"
    },
    {
      "id": "contract_trace_checking",
      "name": "Contract trace validation",
      "summary": "Contracts can be checked against trace JSON for forbidden tools, ordering, required outputs, limits, and refusal behavior.",
      "visibility": "user_visible",
      "status": "verified_pass",
      "confidence": "high",
      "evidence": [
        {
          "kind": "source",
          "path": "contract2agent/checker.py",
          "detail": "Implements trace checking and CheckResult."
        },
        {
          "kind": "test",
          "path": "tests/test_contract2agent.py",
          "detail": "Covers pass/fail trace behavior and CLI checks."
        },
        {
          "kind": "test",
          "path": "tests/fixtures/golden",
          "detail": "Golden diagnosis fixtures exercise expected failure categories."
        }
      ],
      "tests": [
        "tests/test_contract2agent.py",
        "tests/test_golden_diagnosis.py"
      ],
      "docs": [
        "docs/cli.md",
        "docs/CODEMAP.md"
      ],
      "risks": [
        "Weakening checker rules can change many diagnosis and golden outcomes."
      ],
      "notes": "Historical full-suite pass recorded on 2026-05-06.",
      "last_updated": "2026-05-07",
      "last_verified": "2026-05-06"
    },
    {
      "id": "diagnosis_reports",
      "name": "Trace diagnosis, why reports, and regression trace suggestions",
      "summary": "Diagnosis flows produce structured issues, Markdown/YAML reports, why explanations, and suggested regression traces.",
      "visibility": "user_visible",
      "status": "verified_pass",
      "confidence": "high",
      "evidence": [
        {
          "kind": "source",
          "path": "contract2agent/diagnosis.py, contract2agent/diagnosis_schema.py",
          "detail": "Implements diagnosis schema, reports, why output, and regression trace helpers."
        },
        {
          "kind": "test",
          "path": "tests/test_diagnosis_schema.py",
          "detail": "Covers diagnosis issue protocol and report rendering."
        },
        {
          "kind": "test",
          "path": "tests/test_report_rendering.py",
          "detail": "Covers Markdown/JSON report structure."
        }
      ],
      "tests": [
        "tests/test_contract2agent.py",
        "tests/test_diagnosis_schema.py",
        "tests/test_report_rendering.py"
      ],
      "docs": [
        "docs/reports.md",
        "docs/cli.md"
      ],
      "risks": [
        "Large legacy modules need careful scoped edits."
      ],
      "notes": "Verified status relies on dated test evidence, not this docs-only task.",
      "last_updated": "2026-05-07",
      "last_verified": "2026-05-06"
    },
    {
      "id": "quick_deep_auto_diagnosis",
      "name": "Quick, deep, and auto diagnostic modes",
      "summary": "Diagnostic modes run bounded smoke, multi-round, and auto workflows with review policies and confidence estimates.",
      "visibility": "user_visible",
      "status": "verified_pass",
      "confidence": "high",
      "evidence": [
        {
          "kind": "source",
          "path": "contract2agent/diagnostic_modes.py",
          "detail": "Implements quick, deep, auto, review policies, safety checks, and reports."
        },
        {
          "kind": "test",
          "path": "tests/test_diagnostic_modes.py",
          "detail": "Covers mode behavior, clean errors, auto safety, and rollback."
        }
      ],
      "tests": [
        "tests/test_diagnostic_modes.py"
      ],
      "docs": [
        "docs/quick.md",
        "docs/deep.md",
        "docs/auto.md",
        "docs/cli.md"
      ],
      "risks": [
        "Auto mode safety boundaries and write allowlists are critical."
      ],
      "notes": "Do not expand auto behavior without a sprint contract and focused tests.",
      "last_updated": "2026-05-07",
      "last_verified": "2026-05-06"
    },
    {
      "id": "baseline_save_compare",
      "name": "Diagnostic baseline snapshots and comparison",
      "summary": "Diagnostic runs can save baselines, hashes, snapshots, and comparisons for regression context.",
      "visibility": "developer_visible",
      "status": "verified_pass",
      "confidence": "high",
      "evidence": [
        {
          "kind": "source",
          "path": "contract2agent/baseline.py",
          "detail": "Implements baseline save, load, hash, and comparison."
        },
        {
          "kind": "test",
          "path": "tests/test_baseline.py",
          "detail": "Covers snapshots, comparisons, corrupt baselines, and CLI parsing."
        }
      ],
      "tests": [
        "tests/test_baseline.py"
      ],
      "docs": [
        "docs/baselines.md",
        "docs/cli.md"
      ],
      "risks": [
        "Runtime .agentdoctor paths are compatibility storage paths, not project identity."
      ],
      "notes": "Historical full-suite evidence recorded on 2026-05-06.",
      "last_updated": "2026-05-07",
      "last_verified": "2026-05-06"
    },
    {
      "id": "triage_planning",
      "name": "Static triage and recommended next mode",
      "summary": "Static triage detects configuration, risks, coverage gaps, baseline state, and recommended next command.",
      "visibility": "user_visible",
      "status": "verified_pass",
      "confidence": "high",
      "evidence": [
        {
          "kind": "source",
          "path": "contract2agent/triage",
          "detail": "Implements static discovery, classification, coverage, risk, planning, and reports."
        },
        {
          "kind": "test",
          "path": "tests/test_triage.py",
          "detail": "Covers triage CLI, path safety, risk mapping, recommendations, and secret exclusion."
        }
      ],
      "tests": [
        "tests/test_triage.py"
      ],
      "docs": [